{
 "$schema": "https://json-schema.org/draft/2020-12/schema",
 "$id": "urn:tribe:hosted:tribe:v1",
 "title": "Tribe hosted page: tribe",
 "description": "One TRIBE job: the predicted average-brain response as display_z lines on this reel's own scale, peaks and flat stretches. No words, word hits, segments or paths. Never compared across reels (D21). Built from outputs/<job>/report.json.",
 "x-kind": "tribe",
 "x-key": "^\\d{8}-\\d{6}-[0-9a-f]{8}$",
 "type": "object",
 "additionalProperties": false,
 "required": [
  "v",
  "job_id",
  "shortcode",
  "run_date",
  "framing",
  "scale",
  "clip_s",
  "time_s",
  "lines",
  "peaks",
  "flat_stretches",
  "warnings",
  "peak_image"
 ],
 "properties": {
  "v": {
   "type": "integer",
   "const": 1
  },
  "job_id": {
   "$ref": "#/$defs/job_id",
   "x-layer": "ui"
  },
  "shortcode": {
   "anyOf": [
    {
     "type": "null"
    },
    {
     "$ref": "#/$defs/shortcode"
    }
   ]
  },
  "run_date": {
   "$ref": "#/$defs/date"
  },
  "framing": {
   "type": "string",
   "const": "predicted average-brain response",
   "x-layer": "brain"
  },
  "scale": {
   "type": "object",
   "additionalProperties": false,
   "required": [
    "mode",
    "label"
   ],
   "properties": {
    "mode": {
     "type": "string",
     "enum": [
      "within-reel",
      "pair",
      "ref"
     ]
    },
    "label": {
     "$ref": "#/$defs/text",
     "x-layer": "brain",
     "maxLength": 120
    }
   }
  },
  "clip_s": {
   "$ref": "#/$defs/seconds"
  },
  "time_s": {
   "type": "array",
   "items": {
    "type": "number",
    "minimum": 0,
    "maximum": 3600
   },
   "minItems": 1,
   "maxItems": 300
  },
  "lines": {
   "type": "object",
   "additionalProperties": false,
   "required": [
    "seeing",
    "hearing",
    "language",
    "attention",
    "combined"
   ],
   "properties": {
    "seeing": {
     "type": "object",
     "additionalProperties": false,
     "required": [
      "label",
      "display_z",
      "trend"
     ],
     "properties": {
      "label": {
       "$ref": "#/$defs/text",
       "x-layer": "brain",
       "maxLength": 80
      },
      "display_z": {
       "type": "array",
       "items": {
        "type": [
         "number",
         "null"
        ]
       },
       "minItems": 1,
       "maxItems": 300
      },
      "trend": {
       "type": [
        "string",
        "null"
       ],
       "enum": [
        "rising",
        "falling",
        "flat",
        null
       ]
      }
     }
    },
    "hearing": {
     "type": "object",
     "additionalProperties": false,
     "required": [
      "label",
      "display_z",
      "trend"
     ],
     "properties": {
      "label": {
       "$ref": "#/$defs/text",
       "x-layer": "brain",
       "maxLength": 80
      },
      "display_z": {
       "type": "array",
       "items": {
        "type": [
         "number",
         "null"
        ]
       },
       "minItems": 1,
       "maxItems": 300
      },
      "trend": {
       "type": [
        "string",
        "null"
       ],
       "enum": [
        "rising",
        "falling",
        "flat",
        null
       ]
      }
     }
    },
    "language": {
     "type": "object",
     "additionalProperties": false,
     "required": [
      "label",
      "display_z",
      "trend"
     ],
     "properties": {
      "label": {
       "$ref": "#/$defs/text",
       "x-layer": "brain",
       "maxLength": 80
      },
      "display_z": {
       "type": "array",
       "items": {
        "type": [
         "number",
         "null"
        ]
       },
       "minItems": 1,
       "maxItems": 300
      },
      "trend": {
       "type": [
        "string",
        "null"
       ],
       "enum": [
        "rising",
        "falling",
        "flat",
        null
       ]
      }
     }
    },
    "attention": {
     "type": "object",
     "additionalProperties": false,
     "required": [
      "label",
      "display_z",
      "trend"
     ],
     "properties": {
      "label": {
       "$ref": "#/$defs/text",
       "x-layer": "brain",
       "maxLength": 80
      },
      "display_z": {
       "type": "array",
       "items": {
        "type": [
         "number",
         "null"
        ]
       },
       "minItems": 1,
       "maxItems": 300
      },
      "trend": {
       "type": [
        "string",
        "null"
       ],
       "enum": [
        "rising",
        "falling",
        "flat",
        null
       ]
      }
     }
    },
    "combined": {
     "type": "object",
     "additionalProperties": false,
     "required": [
      "label",
      "note",
      "display_z"
     ],
     "properties": {
      "label": {
       "$ref": "#/$defs/text",
       "x-layer": "brain",
       "maxLength": 80
      },
      "note": {
       "$ref": "#/$defs/text",
       "x-layer": "brain",
       "maxLength": 120
      },
      "display_z": {
       "type": "array",
       "items": {
        "type": [
         "number",
         "null"
        ]
       },
       "minItems": 1,
       "maxItems": 300
      }
     }
    }
   }
  },
  "peaks": {
   "type": "array",
   "items": {
    "type": "object",
    "additionalProperties": false,
    "required": [
     "t",
     "driving_lines",
     "edge"
    ],
    "properties": {
     "t": {
      "type": "integer",
      "minimum": 0,
      "maximum": 3600
     },
     "driving_lines": {
      "type": "array",
      "items": {
       "$ref": "#/$defs/line_key"
      },
      "uniqueItems": true,
      "maxItems": 4
     },
     "edge": {
      "type": "boolean"
     }
    }
   },
   "maxItems": 10
  },
  "flat_stretches": {
   "type": "array",
   "items": {
    "type": "object",
    "additionalProperties": false,
    "required": [
     "start",
     "end",
     "driving_lines",
     "edge"
    ],
    "properties": {
     "start": {
      "type": "integer",
      "minimum": 0,
      "maximum": 3600
     },
     "end": {
      "type": "integer",
      "minimum": 0,
      "maximum": 3600
     },
     "driving_lines": {
      "type": "array",
      "items": {
       "$ref": "#/$defs/line_key"
      },
      "uniqueItems": true,
      "maxItems": 4
     },
     "edge": {
      "type": "boolean"
     }
    }
   },
   "maxItems": 20
  },
  "warnings": {
   "type": "array",
   "items": {
    "type": "object",
    "additionalProperties": false,
    "required": [
     "code",
     "text"
    ],
    "properties": {
     "code": {
      "type": "string",
      "pattern": "^[a-z][a-z0-9_]{1,40}$"
     },
     "text": {
      "$ref": "#/$defs/text",
      "x-layer": "brain",
      "maxLength": 300
     }
    }
   },
   "maxItems": 20
  },
  "peak_image": {
   "anyOf": [
    {
     "type": "null"
    },
    {
     "type": "object",
     "additionalProperties": false,
     "required": [
      "key",
      "t"
     ],
     "properties": {
      "key": {
       "type": "string",
       "pattern": "^tribe/\\d{8}-\\d{6}-[0-9a-f]{8}/peak\\.png$"
      },
      "t": {
       "type": "integer",
       "minimum": 0,
       "maximum": 3600
      }
     }
    }
   ]
  }
 },
 "$defs": {
  "text": {
   "type": "string",
   "minLength": 1,
   "maxLength": 600,
   "not": {
    "pattern": "\\\\|(^|[^A-Za-z])[A-Za-z]:/|/Users/|OneDrive|AppData|private/|\\.env\\b|\\.npy\\b|\\.jsonl?\\b|\\.txt\\b|\\.jpe?g\\b|\\.(mp4|mov|m4v|webm|mkv|avi|wav|m4a|mp3)\\b|said: [\\\"“]"
   },
   "description": "Display text: no laptop paths, file names, private folders or quoted speech."
  },
  "text_or_null": {
   "anyOf": [
    {
     "type": "null"
    },
    {
     "$ref": "#/$defs/text"
    }
   ]
  },
  "date": {
   "type": "string",
   "pattern": "^\\d{4}-\\d{2}-\\d{2}$"
  },
  "date_or_null": {
   "anyOf": [
    {
     "type": "null"
    },
    {
     "$ref": "#/$defs/date"
    }
   ]
  },
  "datetime": {
   "type": "string",
   "pattern": "^\\d{4}-\\d{2}-\\d{2}T\\d{2}:\\d{2}(:\\d{2}(\\.\\d+)?)?(Z|[+-]\\d{2}:\\d{2})$"
  },
  "datetime_or_null": {
   "anyOf": [
    {
     "type": "null"
    },
    {
     "$ref": "#/$defs/datetime"
    }
   ]
  },
  "shortcode": {
   "type": "string",
   "pattern": "^[A-Za-z0-9_-]{5,20}$"
  },
  "handle": {
   "type": "string",
   "pattern": "^[A-Za-z0-9._]{1,30}$"
  },
  "handle_at": {
   "type": "string",
   "pattern": "^@[A-Za-z0-9._]{1,30}$"
  },
  "ig_url": {
   "type": "string",
   "maxLength": 200,
   "pattern": "^https://www\\.instagram\\.com/([A-Za-z0-9._]{1,30}/)?(reel|reels|p)/[A-Za-z0-9_-]{5,40}/?$"
  },
  "chip": {
   "type": "string",
   "pattern": "^\\d{1,2}:[0-5]\\d(-\\d{1,2}:[0-5]\\d)?$"
  },
  "chip_or_null": {
   "anyOf": [
    {
     "type": "null"
    },
    {
     "$ref": "#/$defs/chip"
    }
   ]
  },
  "draft_id": {
   "type": "string",
   "pattern": "^\\d{8}-[A-Za-z0-9][A-Za-z0-9-]{1,60}$"
  },
  "pattern_id": {
   "type": "string",
   "pattern": "^(hook|structure|cta|format)\\.(caption|spoken)\\.[a-z0-9-]{1,80}$"
  },
  "job_id": {
   "type": "string",
   "pattern": "^\\d{8}-\\d{6}-[0-9a-f]{8}$"
  },
  "seconds": {
   "type": "number",
   "minimum": 0,
   "maximum": 3600
  },
  "count": {
   "type": "integer",
   "minimum": 0,
   "maximum": 100000
  },
  "line_key": {
   "type": "string",
   "enum": [
    "seeing",
    "hearing",
    "language",
    "attention"
   ]
  }
 }
}
