{
 "v": 1,
 "job_id": "20261001-101500-0a1b2c3d",
 "shortcode": "DEMO0000001",
 "run_date": "2026-10-01",
 "framing": "predicted average-brain response",
 "scale": {
  "mode": "within-reel",
  "label": "relative to this reel's own average"
 },
 "clip_s": 42.3,
 "time_s": [
  0.0,
  1.0,
  2.0,
  3.0,
  4.0,
  5.0,
  6.0,
  7.0,
  8.0,
  9.0,
  10.0,
  11.0,
  12.0,
  13.0,
  14.0,
  15.0,
  16.0,
  17.0,
  18.0,
  19.0,
  20.0,
  21.0,
  22.0,
  23.0,
  24.0,
  25.0,
  26.0,
  27.0,
  28.0,
  29.0,
  30.0,
  31.0,
  32.0,
  33.0,
  34.0,
  35.0,
  36.0,
  37.0,
  38.0,
  39.0,
  40.0,
  41.0
 ],
 "lines": {
  "seeing": {
   "label": "predicted visual response",
   "display_z": [
    0.0,
    0.1987,
    0.3894,
    0.5646,
    0.7174,
    0.8415,
    0.932,
    0.9854,
    0.9996,
    0.9738,
    0.9093,
    0.8085,
    0.6755,
    0.5155,
    0.335,
    0.1411,
    -0.0584,
    -0.2555,
    -0.4425,
    -0.6119,
    -0.7568,
    -0.8716,
    -0.9516,
    -0.9937,
    -0.9962,
    -0.9589,
    -0.8835,
    -0.7728,
    -0.6313,
    -0.4646,
    -0.2794,
    -0.0831,
    0.1165,
    0.3115,
    0.4941,
    0.657,
    0.7937,
    0.8987,
    0.9679,
    0.9985,
    0.9894,
    0.9407
   ],
   "trend": "flat"
  },
  "hearing": {
   "label": "predicted auditory response",
   "display_z": [
    0.713,
    0.7708,
    0.798,
    0.7933,
    0.757,
    0.6906,
    0.5966,
    0.4788,
    0.3419,
    0.1914,
    0.0333,
    -0.1262,
    -0.2806,
    -0.4239,
    -0.5502,
    -0.6546,
    -0.7329,
    -0.782,
    -0.7999,
    -0.786,
    -0.7407,
    -0.6658,
    -0.5644,
    -0.4405,
    -0.2991,
    -0.1457,
    0.0135,
    0.1721,
    0.3239,
    0.4628,
    0.5832,
    0.6803,
    0.7504,
    0.7905,
    0.7992,
    0.7759,
    0.7217,
    0.6388,
    0.5304,
    0.4008,
    0.2553,
    0.0996
   ],
   "trend": "falling"
  },
  "language": {
   "label": "predicted language response",
   "display_z": [
    0.8948,
    0.7182,
    0.5129,
    0.2871,
    0.0499,
    -0.1893,
    -0.4209,
    -0.6358,
    -0.8253,
    -0.9819,
    -1.0994,
    -1.173,
    -1.1999,
    -1.1789,
    -1.111,
    -0.9987,
    -0.8466,
    -0.6608,
    -0.4487,
    -0.2186,
    0.0202,
    0.2581,
    0.4858,
    0.6941,
    0.8748,
    1.0205,
    1.1256,
    1.1858,
    1.1987,
    1.1639,
    1.0826,
    0.9582,
    0.7956,
    0.6012,
    0.3829,
    0.1493,
    -0.0902,
    -0.3261,
    -0.549,
    -0.7501,
    -0.9212,
    -1.0556
   ],
   "trend": "rising"
  },
  "attention": {
   "label": "predicted attention-network response",
   "display_z": [
    0.5798,
    0.705,
    0.8021,
    0.8672,
    0.8977,
    0.8925,
    0.8517,
    0.7769,
    0.6711,
    0.5386,
    0.3846,
    0.2153,
    0.0374,
    -0.142,
    -0.3157,
    -0.4769,
    -0.619,
    -0.7364,
    -0.8245,
    -0.8798,
    -0.8999,
    -0.8842,
    -0.8332,
    -0.749,
    -0.635,
    -0.4956,
    -0.3365,
    -0.1639,
    0.0151,
    0.1936,
    0.3644,
    0.5206,
    0.6561,
    0.7654,
    0.8442,
    0.8894,
    0.899,
    0.8729,
    0.812,
    0.7186,
    0.5967,
    0.4509
   ],
   "trend": null
  },
  "combined": {
   "label": "Combined (locates moments only)",
   "note": "locates moments only, not a rating",
   "display_z": [
    0.4284,
    0.6211,
    0.7891,
    0.9256,
    1.0252,
    1.084,
    1.0995,
    1.0712,
    1.0002,
    0.8893,
    0.743,
    0.5671,
    0.3685,
    0.1552,
    -0.0642,
    -0.2811,
    -0.4868,
    -0.673,
    -0.8325,
    -0.9587,
    -1.0468,
    -1.0931,
    -1.0958,
    -1.0548,
    -0.9718,
    -0.85,
    -0.6944,
    -0.5111,
    -0.3074,
    -0.0914,
    0.1282,
    0.3427,
    0.5435,
    0.7227,
    0.873,
    0.9886,
    1.0647,
    1.0984,
    1.0883,
    1.0348,
    0.9401,
    0.8078
   ]
  }
 },
 "peaks": [
  {
   "t": 21,
   "driving_lines": [
    "seeing",
    "language",
    "attention"
   ],
   "edge": false
  },
  {
   "t": 8,
   "driving_lines": [
    "language"
   ],
   "edge": false
  }
 ],
 "flat_stretches": [
  {
   "start": 30,
   "end": 34,
   "driving_lines": [
    "hearing"
   ],
   "edge": false
  },
  {
   "start": 40,
   "end": 42,
   "driving_lines": [
    "seeing",
    "hearing"
   ],
   "edge": true
  }
 ],
 "warnings": [
  {
   "code": "test_only",
   "text": "A made-up warning for the fixture."
  },
  {
   "code": "timing_untested",
   "text": "Timing against the clip is not tested yet."
  }
 ],
 "peak_image": {
  "key": "tribe/20261001-101500-0a1b2c3d/peak.png",
  "t": 21
 }
}
